Title,Chapter Number,Season Number,Character Names,Dialogue,Narrative,Genre,Special Skill
Friend's Journey,1,1,"Julia, Megan, Diana, Lawrence, Chris, Jorge, Victor, Rose, Marga, Annie","oh lawrence
men may goodnews ako at bad news
unahin mo ung goodnews
uuwi na ko ng pinas
ayos ah anong bad news
walang susundo sakin
yun lang pala kayang kaya yan susunduin naman kita tatawagan ko na lang si Chris para mainform sya na uuwi ka
Di na kailangan nainform ko na sya papakilala daw nya satin ung pinsan nya pati girlfriend nya
ahh ganun ba matagal na din simula nung umalis ka di natin namalayan na nagka gf na si chris. So kelan ba uwi mo
bukas mga hapon siguro
geh hintayin na lang kita Kinabukasan sa airport
hanep tagal ah
Excuse me sir can i ask a question?
waaahh hanep lawrence wag mangbibigla hanep di ako lalaban ng englishan
sorry naman akala ko ba kasama mo si Chris
ayun nga ih ang tagal kanina pang wala imbis na ikaw ung VIP sya ung naging vip saka sabi nya intayin na lang daw natin sya sa coffee shop sa labas
ahh sige tara
may pera ka dyan libre mo ko
nubayan kakauwi ko lang libre agad
joke lang kkb na
oh ayan na pala sa labas si chris oh, may kasamang dalawang babae?
huh sino kaya yun
oh lawrence nandyan ka na pala long time no porn este no see
nako po di ka pa rin nagbabago
oh btw lawrence si megan nga pala girlfriend ko megan lawrence
hi nice to meet you
woi lawrence wag tulala Lawrence: Hello nice to meet you too
at victor pinsan ko nga pala si annie
eh kase nabangga nya ko kahapon campus ewan ko ba parang nagmamadali di man lang ako tinulungan tumakbo habang nagblublush ata sa hiya at dun ko nalaman na magkaklase pala kami
sorry na hehe di ko naman sinasadya na mabangga ka sobrang late na kase di ko rin alam na kaklase din kita. At saka chris bat ka absent kahapon
ahh sya pala ung sinasabi mo na nakabangga sayo anyways nilalagnat ako kahapon kaya di nakapasok
teka nga pala lawrence bat ka nga pala umuwi akala ko ba dun ka na titira
ayun nga akala ko kaso di kaya mas natuto akong maging basagulero sa dami ng bully don at nga pala dito na ulit ako magaaral
you mean magtratransfer ka
oo
sounds good I'm looking forward to be your classmate and be my friend
same for me
(aba mukang hindi kami nito magkaksundo ni lawrence pagdating kay megan)
I am Lawrence Howard from america nice to meet all of you and i am looking forward for the whole school year to get along
Psst Rose ang gwapo noh boy kano pa
nako Rose love at first sight ha
tumigil nga kayo di ko sya type baka type mo sya marga
ho tama na baka marinig pa tayo
hmm mukang magaling mag chess to ah hamunin ko nga mamaya
tama na kaka english nosebleed na ko hahaha
sorry na di ko mapigilan ih
Damare
hay na ko si boy hapon
kesa naman sayo weeb
nakupo
megan sya ba ung tinutukoy mo sakin na katropa ni victor at chris mukang mabait ah type ko sya para sayo at hindi si chris
bakit naman dahil ba galing states
well feel ko di magkakasundo si lawrence at chris pagdating sayo bestfriend na agad si lawrence diba tapos bf mo pa si chris
well sweet naman si lawrence but i think lawrence is sweeter than chris
kase naman laging walang time sakin si chris puro na lang laro ang inaatupag tapos ang daming dahilan na di tinutupad ung promise nya
kung ganun hiwalayan mo na si chris nandyan naman si lawrence pwede ka naman magopen dun
well pagiisipan ko muna give me some time
teka nasan si victor
nasa loob ng room tinatamad daw kumain
haynako mapuntahan nga
hoy victor at tulala ka pa dyan
wala naman nga pala ano nga palang pangalan nung pinsan ni chris na na katabi ni marga na absent
ah si annie bakit mo naman natanong
ahh wala naman
teka nga lang may gusto ka kay annie noh
ah ako wala noh
nako fluster ang hanep nautal nanaman kunyari ka pa teka maiba tayo anong nangyari sa inyo ni nicole
woi tinatanong kita huh? Bakit ka naman naiiyak dyan
limot ko na pinaalala mo pa
anong nangyari ba?
nung papunta akong airport para sunduin ka nakasalubong ko sya nakita ko na may kasamang iba
yun lang pala ang drama mo marami pa dyan nandyan naman si annie na type mo
teka pano mo naman nasabi
you'll find out soon
woi kayong dalawa tagal nyo ah tara na gutom na ko
eto na eto lawrence tara na....
uhm hi lawrence I'm marga
i'm rose nice to meet you lawrence
i'm jorge grabe mas gwapo ka pa pala tingnan pagmalapitan
nako jorge di ka maiintindihan nyan magenglish ka
ok lang sinasanay ko nang magtagalog ulit hahaha
hoy boy kano
huh ako ba
oo mayang lunch may time ka
oo naman
well sa tingin ko marunong ka magchess tara magchess tayo mamaya
sige ba geh maya na lang kakain lang kami
ano bang problema mo di ka naman ganyan ah at saka bat mo naman sinabinang di kita mahal at ang cold ko sayo
wala sakin ang problema ikaw ang may problema kase nang di lang dumating si lawrence galing states hindi ka magkakaganyan wag mong sabihing mas mahal mo si lawrence kesa sakin anong akala mo di ko narinig ung usapan nyo ni diana kanina ano makikipag break ka
oo sawang sawa na ko sa ugali mo wala ka nang time sakin kung ano ano inuuna mo puro ka na lang laro di mo tinutupad ung promise mo mas mabuti pang maghiwalay na lang tayo
fine kung yan ang gusto mo maghiwalay na lang tayo pero wag kang babalik pag nagkaproblema kayo ni lawrence
woi chris megan nandyan lang pala kayo nakita ko nya ba si lawrence
itanong mo kay megan (sabay alis)
anong problema nun. Aba lawrence anong ginagawa mo dyan sa likod
nakita mo pa ko dito eh napadaan lang ako
(anong gagawin ko ako dahilan ng break up pano yun pano ko sya kakausapin)
ano tama ba narinig ko diana balak makipagbreak ni megan kay chris
oo di ko gusto ugali ni chris para kay megan kaya nakunbinsi ko si megan na makipag break at saka may favor ako
aba aba lagi mo kong inaaway dati ah anong meron may lagnat ka ba
wala akong lagnat tungaw
ano favor mo
ireto mo naman si megan kay lawrence after na makipag break ni megan kay chris tropa mo naman yun
oo naman ako bahala
nandyan ka pala lawrence may narinig ka ba
oo sorry kung narinig ko wag ka na umiyak
tara sa canteen para kumain (napabulong sa isip) mukang di ko na kailangan ireto pa
Megan!?
Oh annie nandyan ka pala
totoo ba na nagbreak na kayo ni chris tumakbo na ko papunta dito para malaman ang totoo iniisip ko na nagiisa ka kaso sabi ni diana kasama mo daw si victor at lawrence
ahh kaya pala hingal na hingal ka
sorry annie kung nakipag hiwalay ako sa pinsan mo
nga pala megan pano kayo nagkakilala ni Chris at pano naging kayo", Sinimulan ni Victor ang kanyang umaga ng pagluluto ng kanyang almusal araw na maganda ang panahon at habang nakain si victor tinawagan sya ni lawrence  Ring ring                      Meanwhile sa loob ng coffeeshop          Victor & Annie: Ikaw? Lawrence: ang bilis ah magkakilala agad kayo           At nagshakehands ung dalawa   Matapos ang dalawang araw na walang pasok nagumpisa nang pumasok si lawrence bilang transfer student   Samantala sa likuran            (Recess)         Meanwhile    Teka bat tulala to         Napatingin lang si victor at bigla binaba ang ulo                      Lunch  Habang naglalakad si lawrence pabalik ng room narinig nyang nagaaway si chris at megan    Earlier         Present    Sa canteen        Napatingin na lang si Megan kay Lawrence at nagumpisang ikwento  End of Chapter 1  ,Action/Adventure,Unknown
Friend's Journey,2,1,"Diana, Chris, Megan, Victor","nagsimula 1st day of grade 10 as a mixed section I don't know why but Chris and Victor got diana and my attention and Chris was first to introduce himself to me well at first nahihiya pa syang makipag usap pero si victor at diana naman sa una pa lang they didn't get along unti unti naging magkaibigan kami and after 3 months we became bestfriends we always hangout after class and both of us talk about crazy stuffs our friendship last 5 months when valentines day came he ask me to go on a date syempre nakakahiya naman tanggihan kaya pumayag ako well as usuall we talked about crazy stuffs hanggang sa nabigla ako sa tinanong nya
Megan pano kung yung taong malapit sayo nagconfess ng feelings sayo anong sasabihin mo
syempre confuse pa halos tulala siguro ako ng five seconds after nyang sabihin yun and the i respond
di ko alam bakit sino ba magcoconfess si Victor nanaman hay nako wag na sya umasa diba nga binusted ko na sya
hindi si victor di ko alam ang sasabihin pero
ano?
he look at me straight I didn't see his serious face before and he said...
Megan i like you di ko lang masabi dahil bestfriend kita na baka ireject mo din ako kagaya ni Vic nung times na kinukulit ka ni vic at nagoopen ka sakin di ko alam ang gagawin ko kaya uulitin ko may gusto ako sayo
sa sinabi nya di ko alam ang sasabihin kaya umuwi akong tahimik na nagsecellphone at tinext nya ko
sorry kung nabigla ka sa sinabi ko pero totoo lahat ng sinabi ko pati ung feelings ko totoo yun
tama si Diana dapat nakinig ako sa kanya
huy huy megan
oh kanina ka pa dyan
ay hindi ngayon lang pansin ko nung pumasok ka dito sa kwarto ang tahimik mo na di mo ko napansin na parang multo musta date nyo?
waaaahhhh naalala ko nanaman yun
ano yun?
he confess that he like me at tama ka dapat nakinig ako sayo ate
told you ang bestfriend hindi mananatiling bestfriend na bibigay at magcoconfess sayo. So anong sabi mo?
wala after nyang magconfess hanggang sa umuwi kami tahimik lang ako
hay nako bat di mo pa sinabi na may gusto ka rin sa kanya yun naman ang dahilan kung bakit tahimik ka nung sinabi nya yun diba yun naman hinihintay mo na umamin si chris sayo
oo nga ih
so pano yan may pasok pa bukas pano mo sya haharapin
di ko alam baka siguro magtapos ang maghapon na umamin din ako
ano? Seryoso kang umamin ka anong sabi nya?
wala natahimik lang hayss dapat pala di ko sya binigla
kung nandito lang si lawrence nasermonan ka na nun pero ayos lang yan nakaamin ka na kaso adjustment ang problema mo
oo nga ih
aba nandyan na pala si megan
as expected di sila nagkatinginan eto nanaman sya
aba anong meron di rin sya makatingin kay chris
ikaw tong shock pa rin makakatingin ka pa kaya
sorry naman
hay nako nagsasagutan nanaman
chris...
as expected di sya nakatingin sakin pero si victor nagtataka hay nako simula nanaman ata ng away ni diana at vic
kaya ko to lumapit ka lang sa kanya
Chris?
oh bakit?
pwede ba tayong magusap mamayang lunch
kung ngayon mo na.....
geh yaan mo megan mamaya mo kausapin at ikaw naman wag mangealam
papatayin mo ata ako sobrang higpit ng pagkakatakip mo sa bibig ko
anong paguusapan natin Megan?
totoo na ba yun
ang alin?
yung pagconfess mo sakin yung feelings mo para sakin?
Oo totoo yun walang halong biro
kung ganun ako rin may gusto din ako sayo sasabihin ko sana sayo kahapon kaso nauna kang magconfess",  Megan's POV                         End of Megan's POV Kinabukasan       Diana's POV        End of Diana's POV  Megan's POV          Lunch        Megan POV  after nun sabay kaming kumain at sabay na kami umuwi after 2 months niligawan nya ko hinintay ko munang lumipas ang dalawang linggo para sagutin sya after two weeks sinagot ko sya lagi nya ko nilalambing hanggang sa lumabas ung tunay nyang ugali simula nung isang beses na nawalan ako ng time sa kanya dahil sa pagiging busy ko sa pagdrodrawing hanggang sa wala na rin syang time sakin syempre ok lang sakin yun pero halos inaraw araw once a week nya ko pansinin nung una di nanaman ako nakinig kay ate na makipag break kay chris dahil sa pagiging cold nya pero hinayaan ko na lang kahit maliit na bagay pinapalaki nya sa galit nya  End of Chapter 2 ,Action/Adventure,Unknown
Friend's Journey,3,1,"Megan, Diana, Lawrence, Chris, Jorge, Victor, Marga and julia, Rose, Marga, Annie","taas ng pride ang pinaka ayaw ko sa kanya na umaasa ako one day na bumaba sana yun kaso nagkamali ako kaya sumakto na nandito ka Lawrence na nakipag break ako para hindi na lumala na umabot sa punto na magaway pa kayo
eh dapat naman sa una di mo na sinagot
ang sama neto palibhasa di ikaw ang pinili ko
sorry na hahaha
tama lang desisyon mo na makipagbreak kaya wag mo na isipin yun kaya kung may iba ka pang problema lumapit ka lang sakin at saka annie, victor bat ang tahimik nyo naalala ko nung nasa coffee shop tayo----
ahh sya pala ung nakabangga sayo
naalala mo pa yun
oo naman
oo nga noh nawala nga panyo ko nung nabangga mo ako
iinisip mo pa rin yun
well that day
Haaaannnneeeepppp 6:15 na late na ko kaya nagmadali akong maligo, magdamit at wala pa rin akong masakyan pero sinwerte na nakasakay ako kaya pagbaba ko tumakbo na ko na halos nakalimutan kong magbayad ng pamasahe nako may mababangga pa ata ako taaabbbeee ""bang""
aray tumingin ka naman sa dinadaandaanan mo
ay sorry hindi kita napan-----
(ang ganda nya ano kayang pangalan nya shit late na pala ako makatkbo na nga)
hoy! Nubayan di man lang ako tinulungan teka nasan panyo ko
teka kanino ba itong panyo ayun may pangalan ""annie"" sino yun sya ba yung nabangga ko lagot pano ko to isosoli itatapon ko na lang siguro ay wag pala itatago ko na lang siguro para makapagsorry sa susunod at introduce sarili ko
nasayo pala panyo ko bat di mo pa binalik
nahihiya kase ako baka magalit ka teka eto pala panyo mo nilaban ko pa yan
wow nilaban talaga tnks
so pano friends I'm victor
friends and I'm annie
so dito pala namin kayo makikita
ate diana, chris, marga, jorge, julia, rose
hay salamat naalala mo din pangalan namin
oo nga kala ko pa naman malilimutan mo
true
bat ka nandito chris akala ko ba ayaw mo na makita si megan
nandito ako para kausapin si megan sorry sa mga nasabi ko pumapayag akong makipag break sayo dahil napagtanto ko ung mga pagkakamali ko sayo kaya can we still friends again
(naiiyak) sa wakas ang pinakahihintay ko ang pagbaba ng pride nya sure friends na ulit
so pano ba yan
pwede ba na maging magkaibigan tayo lahat
oo nga napagusapan naman namin to nina marga, jorge, diana, julia at chris
sure sounds good to me
that's nice to hear
sure ok na ok
magkakaibigan lang di ba pwedeng magbebestfriend at magkabarkada na","       At coffee shop        1st day of grade 11  Victor's POV   End of Victor's POV  Annie's POV  Sa sobrang excite ko malelate pa ata ako debale na nga first day ko pa lang naman hayss san nga pala room ko ""taaaabbbeeee"" huh sino---- ""bang""  End of Annie's POV     Sabay karipas ng takbo   Victor habang natakbo   End of Victor and Annie's POV       At nagshake hands ang dalawa                 Lawrence, Annie, Megan, Chris, Marga, Jorge, Rose,Julia, Diana: ok na ok!  End of Chapter 3 ",Action/Adventure,Unknown
Friend's Journey,4,1,"lawrence, Lawrence, Chris, Victor, Bully","sana di malate 1st day ko naman ng grade 9 hay salamat on time pero san dito room ko ayun may tao matanong ko na
senior hmmm di ko rin alam grade 9 lang din ako tara sabay tayo
ok lang ba
oo naman magkasing grade lang naman tayo oo nga pala ako nga pala si Christoper
victor naman pangalan ko
ang alam ko ang room ng grade 9 ayun dun ata sa 4th floor
sige tara
aba tamang tama wala pang teacher
tabe mga nerd!
huh?
bakit may problema ba
ah wala pwede ka nang dumaan
hoy basagulero sinong nerd
ano may sinasabi ka nerdy boy
ahh wala sabi ko dumaan ka na hehe
akala ko pa naman papatulan mo na
nakakasawa na mga tinda ano pwedeng makain
di ko rin alam parang gusto ko na lumabas ng campus para bumili ng makakain kaso bawal huh diba si Lawrence yun
Lawrence? Ung nagsabi saating nerd?
oo teka tatlo nakapalibot dun ah mga kaibigan nya ata
ano nerd nasan ang pera namin
sabi ko nang wala bakit ba ang kulit nyo
oo nga eto tatandaan mo nerd walang boss boss dito tandaan mo
hoy tatlong bakulaw
ikaw bakit ang hihina nyo isa laban sa tatlo bakit di nyo subukan tatlo laban sa tatlo
mga bakla
caugh caugh
ok ka na kaya mo pang tumayo
oo salamat look sorry kung binubully ko kayong dalawa di ko ineexpect na tutulungan nyo ako
wala yun
so pano friends
oo nga friends
sure no prob
hay salamat uwian na
hoy wag kang tumakbo
oo nga di kami makahabol
hahaha mataba ka lang chris at mabagal ka lang victor
wait sasagutin ko lang to
hello
amerika?
ok bye bye
tara sa coffee shop may sasabihin ako
oh sige
sa amerika ka pinagaaral
puro astigin dun at mapuputi di kaya mabully ka lang dun
oo kakayanin at saka wala akong pake kung mapuputi sila kaya ko makipagsabayan
so kelan ka daw aalis
next month
agad gad ang bilis naman edi ibig sabihin dun ka titira
oo
kung ganun ingat
oo nga mag enjoy ka wag ka papabully ulit
of course","  Uhm senior san po dito makikita room ng grade 9        Umakyat ang dalawa para hanapin ang room nila           Nagumpisa ang klase na parang walang nangyare sa tatlo hanggang uwian at makalipas ang ilang linggo naging magkaibigan si chris at victor hanggang sa pagsabit ng lunch  Lunch        Bully 2: aba sasagot ka pa anong akala mo ikaw boss   ""pak""  Natumba si lawrence sa lakas ng suntok at dun sya umpisang pinagtulungan hanggang sa   Bully 1: sinong tinatawag mong bakulaw   After 5 minutes  Bully 1: takbo di natin kaya yang mga yan  Bully 2: huling hirit nyo na yan  Bully 3: may araw din kayo samin tatlong nerd          Chris's POV  Seven months nabuo ang pagiging trio namin hanggang sa may balita kaming di namin inaasahan  End of Chris's POV      Sa Coridor  Ring ring    After 4 secodns   Napatingin si chris at victor habang nagtataka     Sa Coffee shop  Chris & Victor: ano!?            Natapos ang dalawang taon na di nila kapiling si lawrence at nanatili si victor at chris na magkaibigan kahit wala si lawrence  End of Chapter 4 ",Action/Adventure,Unknown
Friend's Journey,5,1,"Julia, Morge, Chris, Merga, Jorge, Victor, Rose, Marga","ano ba yan first day na first day agang aga kanina may tatlong lalaki agad na magaaway
hay nako sis hayaan mo na sila magsasawa din yan let's have a wonderful year
oo nga ang mahalaga magkakaklase na tayong tatlo
uy marga kanina ko pa napapansin ung girl na yun
bakit naman interesado ka ata
ang tahimik ah parang mataray sya (and familiar sya sakin)
wow grabe muka naman mabait porket walang kausap mataray na rose lumapit ka nga ask mo name
ano ba yan sinabi mong mabait pero bakit parang takot ka ok fine ako na gagawa
um hi anong name mo
huh ako ba ay sorry hehe lutang kase ako sa sobrang tahimik
ok lang napansin ko kasing walang nakausap sayo
wow ha ikaw lang nakapansin
oo nga
ang bilis nyo naman
ako nga pala si marga pwede mo kaming maging kaibigan
ako naman si rose nice to meet you
julia pangalan ko nice to meet you tara kumain sumama ka na
Hi I'm Jorge ok lang sa inyo na sumama ako
oo naman so pano friends na tayong apat
sure sounds good to me
aba kawawa ung isang basagulero na kakalase natin dun oh pinagtutulungan tumawag na kaya tayo ng teacher
wag baka pag nalaman nila na tayo ung nagsumbong baka kung ano pa gawin satin ng mga yan
oo nga kaya wag na tayo mangealam
i agree
teka ung dalawang nerd na gwapings na kaklase natin oh ano kayang ginagawa nila dun
aba oo nga noh ano kayang ginagawa nila
wag nyong sabihing...
sasali sila sa gulo
pustahan tayo rose matatalo ung dalawang nerd
sige ba ipupusta ko na mananalp ung dalawa
nagpustahan pa
aba nagsitakbuhan na akalain mo yun nanalo pa sila
oh pano ba yan nanalo sila
oh eto
10 pesos lang nubayan sabagay wala kang sinabi kung magkano
balato naman hati na tayo
ok
aba wala si lawrence ah isang linggo nang absent yun
oo nga noh
itatanong ko na lang kina chris at victor
oy victor
oh?
napansin naming apat na isang linggo nang absent si lawrence ah
ahhh sino ka nga ulit?
nu bayan nakalimutan mo nanaman jorge ang name ko
chris sabihin ko na ba
bat sakin ka nagtatanong
si lawrence ba ayun nasa amerika dun na titira at magaaral
huh? Bakit daw anong reason
ayun nga ih di sinabi ang reason
ok tnks
mabait naman pala si jorge
oo di ko nga maimagine na nanginginig binti mo
kasalanan ko ba na akala ko mataray
oo for unknown reason","  Lunch                      After 1 week             After 5 minutes        After eight months                   Meanwhile  Marga, Rose & Julia: ano sa amerika na nakatira at nagaaral   Natapos ang taon na kaming apat ang magkakabarkada and it's four years of amazing journey for junior high school  End of Chapter 5 ",Action/Adventure,Unknown
Friend's Journey,6,1,"Julia, Vince, Megan, Diana, Teacher, Lawrence, Chris, Jorge, Victor, Annie, Rose, Marga, Waiter","sagutin mo na yan ingay ng ringtone mo iniisip ng iba may babagsak na nuclear bomb
eto na eto na
hello
oh ate ikaw pala bat ka napatawag
(ang akala ko ba mas matanda to bakit ate tawag nya)
aba ayos yan edi dito ka na magaaral
nice ok bye bye
sino yun
ah ayun ba pinsan ko babae
aba di ko alam yan dito na magaaral?
Oo sana makilala mo
nubayan mahiyain ako sakin mo pa ipapakilala pwede mo naman ipakilala kina marga
Sabagay
sa tingin mo mix nanaman ba ulit tayo sa grade 11
oo kaya imposibleng maging kaklase natin pinsan ko
may point ka dun pero ok lang yun kung di papalarin na di natin maging kaklase swerte kung magiging kaklase natin
dami mong sinabi may pangbayad ka ba sa bill na kinain natin
nu ba yan meron pag wala 123
ay shit wala ikaw ba?
wala rin so pano
1
2
3 takboooo
hoy bayad nyooo
nabigla ako dun ah kakakain lang natin ih
kesa naman paghugasin tayo ng pinggan
nga pala musta na kayo ni mgean mukang nagwowork kayo ah
oo nga ih ok lang naman minsan away minsan lambing
Ayos 1st day of grade 11
excited ah parang di ka nakatulog
yaan mo sya babe ikaw tatanungin ko babe nakatulog ka ba ng mahimbing kagabi
oo naman ikaw ba babe
sus maniwala naglaro pa nga tayo pagkatapos mong sabihin kagabi sa na ""goodnight bye""
ahh ganun ba oo nakatulog ako ng mahimbing puro ko nanaman laro
nagsalita ikaw nga megan nagdrodrawing pa pagkatapos mong mag i love you
nakupo
nga pala chris bat di mo pala kasabay kanina pinsan mo kaklase natin diba
ano kaklase natin?
magugulat lang pero wag magblublush
magpapalate daw sya pinayagan naman sya ng teacher
ok class please keep quite magpapakilala ngayon ung transfer student sige iha pumasok ka na at magpakilala
(ang ganda)
hoy wag tulala
ay sorry
Hi guys ako nga pala si annie 18 years old galing akong manila and pinsan ako ni chris nice to meet you everyone
ok dun ka umupo sa tabi ni diana
aba swerte
(phew muntik na yun mas lalo siguro akong mamumula kung katabi ko sya 18 lang sya which means mas matanda sya sakin ng isang taon)
hoy victor kanina ka pa tulala sa klase hanggang ngayong lunch lalim ng iniisip mo ah
ah wala ano sinasabi mo wala akong gusto ah
(ano ba yan kung ano ano na sinasabi) hoy kumalma ka
oh bakit
matagal tagal na rin noh simula nung pumunta ng amerika si lawrence
oo nga ih di pa nya nakilala si megan at diana at for sure namimiss na sya ni marga, jorge, rose at julia teka nga pala nasan si megan at diana
nasa room kasamang kumain si annie
ang bilis naman nila maging magkaibigan
of course mamimiss namin si lawrence
wow ha di pa nga kayo close ni lawrence namiss mo na
oo nga baka nga pag nakausap mo magnosebleed ka pa
hay nako ingay nyo
nandyan pala kayo kelan pa kayo nandyan
kanina pa
kanina ibig sabihin rinig nyo usapan namin
oo at saka ano tong narinig ko na wala akong gusto ha type mo si annie noh
oo nga victor nako first day pa lang type mo na agad
huh nagblush
nagumpisa nanaman magblush to ops victor kalma baka kung ano ano nanaman sabihin mo jan
wala akong gusto please wag nyo sasabihin please
jorge
aba naalala mo na pangalan ko ah ano yun
kausap ko si lawrence kanina uuwi daw si victor bukas ng hapon
aba ayos ah ano englisero na ba nung nakausap mo
oo
nga pala lawrence miss ka na nina marga tinanong ako dati ni jorge kung bakit absent ka ng isang linggo dati sinabi ko na nasa amerika ka sasabihin ko na ba na uuwi ka
ahh ganun ba oo naman pero kung sasabihin mo man at tinanong ka kung englisero na ko sabihin mo oo
marga, julia, rose uuwi daw bukas ng hapon si lawrence sabi ni victor englisero na daw nung kinausap nya
so pano yun magpapakilala ulit but in english
oo naman baka kase limot na tayo
praktisinin na natin
kelangan pa talagang magpractice
(Hayss makaupo na nga lang pano to pano ako magsosorry kay annie nito dahil nabangga ko sya kahapon ang masama nito nasakin pa panyo nya pano ko to isosoli mamayang uwian na lang siguro)
huy victor
oh bakit megan
anong bakit ako sana magtatanong ng bakit tulala ka nanaman ok ka lang ba
oo nga victor may problema ba
ah wala naman iniisip ko kase kung pano ung-----
chris megan pakoya naman assignment oh
lagot pano ako haharap sa kanya baka maalala nya ako dahil nabangga ko sya makapagtakip nga ng libro
(anong trip ng lalaking to napadaan lang si annie nagtakip na ng muka teka namumula pa)
anong gagawin ko isosoli ko na ba o mamayang hapon na hayss hirap mag decide ah makapag cr na nga lang
san punta nun oh diana san ka pupunta
ewan ko dun
ah wala mag ccr lang
kalma victor isoli mo na mamayang uwian wag kang mahihiya be a man kaya mo yan makalabas na
bakit ka namumula habang nagtatakip ng libro habang nandun si annie may gusto sa kanya noh
napansin mo pa yun at saka anong sinasabi mong may gusto ako kay annie wala noh
sus kunyari ka pa di ka na nga nagblublush kay megan tapos ngayon kay annie na
hay nako dyan ka na san ka ba pupunta
canteen
libre
aminin mo muna
na ano
na may gusto ka kay annie
wala
edi di kita ililibre
eto na isosoli ko na talaga lumapit ka labg at tawagin mo ann----
annie
(sa monday na nga lang) (sabay karipas ng takbo)
woi victor hintay bilis tumakbo nun ah
(wala daw gusto ah dapat di tinawag ni megan sayang momentum nun)
dapat pala magsorry na agad ako kahapon sa kanya
taaaebbeee
aray tumingin ka naman sa dinadaanan mo
ay sorry di kita napan----
bakit pa kasi natulala lang ako at kumaripas ng takbo hays bahala na nga isipin mo na lang kung pano susunduin si lawrence bukas","  At Mall  Ring ring                              Natapos ang araw nang nakauwi ang dalawa matapos mag 123  After 2 months of vacation                                          Friday       Flashback    Present time                    Sa cr ng boys              After Class       Sa Coridor   Flashback   ""bang""    End of Victor's POV   End of Chapter 6 ",Action/Adventure,Unknown
