Title,Chapter Number,Season Number,Character Names,Dialogue,Narrative,Genre,Special Skill
Friend's Journey,37,3,"Julia, Ethan, Joy, Brittney, Diana, Rose, Daniela, Alice, Maxine","Maxine anong gusto mong gawin natin ngayon?
di ko nga alam ano ba pede gawin?
binalik ang tanong sakin kaw Alice ano maganda gawin ngayon?
mag mall nakakabagot din kase diba.
nga pala diba pupunta si brittney ngayon?
hindi daw may gagawin pa daw sya.
girls tita rose nyo nandito
hi tita
hi po
hello po tita
tita rose hi po
hello sa inyo
anong ginagawa mo dito?
kase may gusto akong ipakilala sa mga bata.
ahh ganun ba sige go lang
huy labas na dyan
(he!? Akala ko ba kina harvy pupunta? Naisahan nanaman ako ni mommy)
girls si ethan
hello
h.....hi
i hope you all get along with each other.
uhm tita rose?
bakit?
bakit di nyo po sinama si brittney?
sabi sayo mommy si brittney na lang sinama mo
he manahimik ka dyan lalaki ka lagi kang nakakulong sa kwarto mo tapos uuwi kang pasaan kaya it's time meet new friends
i told you naman po si arwin po ang nagsisimula ng ayaw po namin
ahh shash shhhh
tita rose
oh bakit
ako bahala sa kanya hihi
sige maxine sabihin mo sakin pag may ginawang kalokohan yan. Wala pa kasing nagiging kaibigan na babae yan kaya sa inyo ako lumapit.
sure
narinig mo yun ethan? Comeon hang out with us kaclose naman namin kapatid mo noh
at kinukwento ka naman nya samin kaya kilala ka na namin.
wag ka mahiya
i guess i have no choice pero sige salamat hihi.
and ethan, gusto mo friends na tayo?
really you mean it?
oo naman since wala ka pa daw nagiging kaibigan na babae kami ang first friends mo in girls.
(mommy talaga) sure!
hi guys. Huh? Anong ginagawa mo dito?
sinama ako ni mommy dito. Hindi ba nya sinabi sayo?
hindi eh pero sige lang
ang akala ko ba may gagawin ka?
tapos na. Naalala ko kasi kagabi na pinagawa kay kuya assignment ko.
ethan and i became friends that day and we got along with each other. I accepted him as a friend cause  first time ko magkaroon ng kaibigan na lalaki. Unti unti kaming lumaki at nakakasama ko sya pati na rin sina Daniela, Joy, Alice at Brittney. Mabilis sya makisama at dahil samin nawala ang pagiging mahiyain niya.
Mom alis na po ako.
ingat ka
opo. (Mukang maglalakad nanaman ako at walang masakyan) hm?
oii maxine
oh ethan bat ngayon ka lang papasok?
nalate ako ng gising ikaw ba?
tinatamad akong bumangon.
sabay ka na sakin magmomotor na tayo papasok papagas lang ako.
sure no prob
di ba papasok si maxine?
papasok yun, tinamad lang siguro bumangon
samantalng ung isa wala pa din.
oo nga noh
brittney bat wala pa kuya mo?
di nyo pa ba nababalitaan?
huh? Di pa.
oo nga ano yun?
anong nangyare?
naaksidente si harvy kagabi, nasagsaan daw, si ethan ang nagdala sa ospital.
seryoso!
anong nangyari kay harvy?
ewan umuwi na si ethan nung dumating ni parents ni harvy
bakit si ethan ang naghatid?
oo nga bakit kaya?
si ethan yung pinagkatiwalaan ni tito lance na bantayan tuwing aalis ng gabi nang di namamalayan ni harvy.
hi guys
nandyan ka na pala bilis nyo ata.
uhm sumabay na ko kay ethan.
kaya pala
nga pala maxine?
yes?
nasabi na nya ba sayo?
(nagblush) a...alin!? (Kaya pala ang tahimik)
so hindi pa (he?)
ano't namumula ka dyan?
ah wala wala. Ano ba ung di nya sinasabi sakin?
childhood friends tapos di pa pala nasasabi.
ang tahimik nya kase pamula kanina.
ako na nga magsasabi. Ahem naaksidente si harvy kagabi at si ethan ang nagdala kay harvy sa ospital.
ano? Teka bakit si ethan ang nagdala?
si ethan daw yung pinagkatiwalaan ni tito lance na bantayan tuwing aalis ng gabi nang di namamalayan ni harvy.
ahh i get it. Di pa nya sinasabi siguro i'll him later
(looked at ethan) (why did he not tell me what happen last night)",                                               End Of Flashback  Maxine's POV   End Of Maxine's POV           At School                                    End Of Chapter 37 ,Action/Adventure,Unknown
Friend's Journey,38,3,"Arwin, Ethan, Brittney, Joy, Athena, Clara, Miggy, Jordan, Mariel, Camille, Raven, Macky, Marvin, Alice, Clarence, Maxine","(sabi sakin ni kuya sabay kaming papasok ngayon, nakalimutan nya ata at napaaga ang pasok nya. Hm? Si maxine ba yun?) Maxine.
oh brittney kaw pala (yawn) di mo taa kasama si ethan?
malay ko dun sabi nya sakin sabay daw kami ngayon pagtibgin ko sa kwarto nya wala na sya, nakalimutan nya ata at ang aga siguro pumasok.
nako po... (Nakabangga) sorry
bakit maxine?
nothing I thought I saw someone we know. (Yawn) kaantok.
mukang di ka ata nakatulog ah?
oo nagbabasa pa ko kagabi, nag online pa ko nakita ko chat ng kuya mo kung may assignment na ko, saka ko pa lang ginawa. Ikaw ba meron na???
pinagawa ko kay kuya, wala naman syang ginawa kundi maglaro pero ang bilis matapos sa assignment.
buti pa to papagawa ko sana kay alice kaso tulog na.
huy san ka pupunta eto room natin?
ay oo nga buti pina-alala mo. Hm? Yun pala kuya mo oh. Ethan!
tulog nanaman (nilapitan ko kung saan sya nakaupo) hoy kuya gigising gising ka ng maaga para pumasok tapos dito mo itutuloy tulog mo.
ok lang yon, di naman ako late.
kung sabagay.
talk about being late, ang alam ko nakaklimang late ka na ethan.
huwag nyo bilangin late ko, isang late ko pa suspended nanaman ako hihi.
buti nga sayo.
ok class go back to seat, let's start our lesson.
ok that's it for today don't forget all of your task, enjoy your lunch.
sir?
make sure na di ka ulit matutulog sa susunod, kapag nakita kitang tulog sa PE, patatakbuhin kita ng dalawang ikot.
(shiver) opo!
oh matutulog ka agad.
maya na ko kakain.
nga pala ethan. You know clarence and miggy right?
yeah elder brother of harvy. Why?
yung mga kaibigan nila kilala mo?
hindi, pero alam ko mga kapitbahay natin sila, minsan ko lang sila nakikita.
sabi sa inyo di nya kilala, tara na sa canteen, hoy ikaw sumama ka na (sinabi ko yon habang hinihila kamay nya)
eto na eto na, kaw talaga ang happy mo, ano gusto mong kainin? Ako na bibili.
wow sweet naman ng kuya ko kahit tulugin, ako na para di ako maboring dito.
tara guys.
ang boring. Athena suggest ka naman ng gagawin.
ayun nice savage plus victory. Ha ano yon mariel?
ang sabi ko suggest ka gagawin.
hmmm alam ko na.
ano?
raven, clara anong pewedeng gawin?
binalik tanong sakin. Tara na na lang sa canteen.
ayun ang magandang gawin. Clarence miggy sama kayo?
kung sasama kayo sa canteen. Kanina pa kayo nakatulala, what's wrong?
ah yun ba, nag aalala lang kami kay harvy.
di pa kase nagigising, pero tara na sa canteen.
sayang di natin sya nakasama bago man lang sya naaksidente
ang pagkakaalam ko ang huli nyang kasama ay sina Arwin at Marvin ng Class 9-C
oo nga kaso nung umaga bago sya maaksidente ng gabi nag away pa kaming dalawa dahil.
umaga na sya nakauwi.
i heard that guy from class 9-B ang nagdala kay harvy sa ospital? Yung kapatid na girl at isang childhood friend?
ayun ba yung pinagkakatiwalaan ni tito lance kada aalis ng gabi si harvy ng di nyo namamalayan
yeah.
you mean maxine, joy, daniela, brittney and yung isa sino nga ba yun?
yung nagdala kay harvy sa ospital?
ahh si ethan. Ang alam ko ethan and maxine are childhood friend then daniela ang joy are sibling, ethan and brittney are siblings maxine and alice are sibling but joy, daniela and brittney are the first of maxine's friend.
nakikita namin sila minsan magkakapit bahay naman tayo.
pag nakita natin sila we should ask them na maging kabarkada natin.
sure why not.
tara na sa canteen
eto na nga oh papunta na tayo.
sya sigi.
oh mariel bakit napatigil ka dyan?
sila yun diba?
aba oo nga noh
lapitan nyo kaya.
kayo na lang, di ako mahilig mag first move.
brittney
hm? Clarence?
kuya mo?
oh nawawala nanaman yun, nakita mo ba yun, maxine?
ba oo nga noh baka....
at bakit mo ko hinahanap clarence??
wala na yo musta?
ok lang naman kayo ba? Kamusta si harvy?
hindi pa din nagigising. Btw Ethan Brittney, Maxine, Daniela, Joy, and Alice I am Miggy this Mariel, Clara, Raven, Athena, clarence jord... Wait nasan si jordan?
nasa room tinatamad sumama.
and this brittney my sister, maxine my bestfriend, joy, daniela and alice.
ahem
ay oo nga pala Ethan, Brittney, Maxine, Joy, Daniela & Alice ok lang ba s ainyo na maging kabarkada namin.
ayos si harvy na lang kulang.
isama na pag nagising sya at...
Arwin? And then.
Marvin?
wag kang mag aalala arwin, marvin sawang sawa na din ako sa pagmumuka nyong dalawa at saka ayaw ko na din makita.
ho? Nacoma lang si harvy tumapang ka na.
oo nga ang akala ko ba duwag ka dati.
sa lahat ng pede mo matawag na pangalan
wag lang ang kapatid namin
dahil kung hindi
ethan?
so what kung tumapang ako, kapag nalaman ko lang na kayo ang nasa likod ng pagkakasagasa at pagka coma ni harvy. Malalagot kayo sakin at hindi ko kayo mapapatawad.
ehhh?? Still blaming the both of us alam ko na nandun ka rin
at saka bakit di ka pumagitna nung sasagasaan na dapat si harvy edi sana ikaw nasa kalagayan ni harvy ngayon
marvin baka nakakalimutan mo duwag yan kaibigan nga nya di nya mailigtas bago maaksidente, barkada pa kaya nya.
(grining teeth)
babye ethan have a wonderfull day
maxine!?
(nod) let's go hayaan mo na sila
(sigh) arwin tama ka duwag nga ako. Pero sinisiguro ko na di mo makukuha ang manager position sa company ni tito lance kahit magpakamatay ka pa at saka marvin oo duwag ako pero wag na wag kong mababalitaan na ilalagay nyo sa panganib ang mga barkada ko dahil tandaan mo. Hindi kita mapapatawad.
(grining teeth) (this idiot!)
(grining teeth)
let's go guys, let's leave this trash."," While walking in hallway      ????: Sorry                 Later At Lunch                Meanwhile at class 9-A          Clarence & Miggy: ha?                           Maxine's Side            Ethan, Brittney, Maxine, Joy, Daniela, Alice Mariel, Clara, Raven, Athena, & Clarence: hi guys    Ethan, Brittney, Maxine, Joy, Daniela & Alice: sure!    Guy 1: So if isn't ethan long time no see.  Guy 2: Sa lahat ng lugar na pede namin puntahan ikaw pa makikita namin          Hinawakan ni ethan ang balikat ni clarence         Hinayaan ni ethan na makapunta sa likod nya si marvin at saka biglang tumalikod si ethan para suntukin si arwin yun nga lang hinawakan ni maxine sa kaliwang kamay si ethan para pigilan ito        End of Chapter 38  ",Action/Adventure,Unknown
Friend's Journey,39,3,"Ethan, Brittney, Clara, Athena, Harvy, Clarence, Lance, Marvin, Daniela, Alice, Arwin, Joy, Megan, Mariel, Chris, Raven, Miggy, Britnney, Maxine","dun lang kami sa kabilang canteen, you guys join us if you want.
(sigh) that was close
buti na lang hinawakan mo agad kamay ni ethan dahil kung hindi
away nanaman
come to think of it nagawa mo silang sagot sagutin ng ganun ah. Good job
dinamay nya kayo pati si harvy hindi talaga ako magpapatalo dun.
ikaw huwag ka basta basta papatol, ang tapang tapang mo dalawa yun oh, anong akala mo tutulungan ka ni clarence at miggy, gusto mo atang macoma dahil sa bugbog! (Habang hila hila ko ang tenga nya.)
aray aray aray aray! Sorry na di na mauulit pangako, bitawan mo na tenga ko bunso please.
apology accepted wag ka lang sakin magsorry bilang kapatid mo sa kanila din.
sorry for making you worry maxine. I promise i'll never do that again.
ok lang yun pinagtanggol mo naman kami, wag mo pang uulitin pinag alala mo kapatid mo sa action mo.
same with me
yeah me too.
let's join clarence and the others to eat some lunch.
wait lang hoy hintayin nyo ko.
hurry up slow poke
oh bat ngayon lang kayo?
oo nga lunch na kayo pumasok
(tumingin kay clarence)
(nod)
guys listen up.
nagising na si harvy kanina.
(looked intensely) (haha, this is.....)
(going to be fun.)
pero may isang problema.
what is it?
half of his memories are gone
(looked intensely) impossible.
half of his memories are gone?
yeah
which mean wala syang maalala kahit nung naaksidente sya
oo dahil nagbago si harvy, kung dati ay pala away, mayabang, di nasunod at rule breaker nawala lahat ng yun
so may chance na bumalik ang memories nya.
hindi alam ng doctor kung babalik pa.
mahihirapan kayo kung sino ung nagtangkang pumatay kay harvy
ayun din ang iniisip ko.
then it's a good thing.
what do you mean it's a good thing
Mariel, Raven, Clara and Jordan hindi na kayo mag aalala pa dahil nga nagbago na sya dahil sa aksidente panigurado na sa inyo na sya sasama.
ethan's right kailangan kayo ang mauna nyang makita para ma konbinse nyo sya na kayo ang una nyang barkada.
so kelan sya makakalabas ng ospital?
bukas ata
(pano ko sasabihin sa kanila?)
half of his memory lost!?
yeah dahil daw dun ung dating harvy magbabago ngayong nagising na sya. May favor ako sa inyong dalawa miggy, clarence
sure dad
isali nyo si harvy sa barkada nyo. Makakatulong yun para kapag bumalik ang kalahati ng ala-ala nya ay babait sya.
yes dad.
(is it possible? If it work then wala kaming magiging problema kay harvy.)
sasali ako sa barkada nina kuya? Sure why not.
(that's fast walang reklamo, what a relief) yes the truth is barkada mo sila dati, kasama kuya miggy at kuya clarence mo, the rest are athena, mariel, clara, and raven, don't worry they know you kaya makakabond mo ulit sila.
yes and I heard na bagong dagdag sina ethan, brittney, maxine, joy, daniela at alice ng class 9-B and btw class 9-A ka kasama nina clarence.
uuwi na kami sasama ka ba?
maya po muna ako stay lang ako saglit dito sarap mag pa aircon eh.
sige uuna na kami eto address natin puntahan mo na lang mamaya.
sure ingat po.
bye
(face palm) (nacoma ako? I'm trying to remember what happen that day. But it's just blury whos the other two I'm with? I can't tell who they are, ano ba kase pinaggagawa ko dati? Aray! Trying to remember it just cause me head ache, I'll wait till my memories came back even tho my old self is an idiot egocentric.)
handaan? Mamaya sa tambayan?
anong meron?
makakalabas na daw ng hospital si harvy ang kaso nagstay muna dun at sinusulit ang aircon.
and we're invited later and also our parents, teka nasan yung magkapatid?
ayun ba? Si ethan tulog daw si brittney naman nandun sa kanila nanonood.
puntahan mo nga maxine and tell them we're invited later.
ako na po.
sino yan (binuksan pinto) oh maxine ikaw pala, anong meron?
wala naman, sabi kasi nina mariel invited daw tayo including tito chris and tita rose, mamaya sa tambayan, ngayon daw ang labas nya sa hospital and we're celeberating it.
sure no problem I'll tell kuya, see you later.
ok thanks see ya.
kuya?
pasok
pinapasabi ni maxine.....
(chomp) ano?
that's my last pizza right?
di ah meron pang isa dun sa ref. Ano yung pinapasabi ni maxine?
invited daw tayo mamaya kina tito lance they're going to celebrate yung paglabas ni harvy sa hospital. Since busog ka na ako na lang pupunta.
isang slice lang naman kinain ko. Sure sabay na tayo mamaya, I'll going to finish this game first.
ok. Wait you got no kills do you?
yyyyeah kanina pa ko naglalaro ng cod imbis na matulog di pa ko nakakakill.
let me play.
let's play with each other di na tayo nakakapag laro this past few days.
sure? Anong lalaruin natin?
(ang saya nila tingnan keep that bond as brother and sister, you'll save each other someday.)","  At Room Kinabukasan Ethan, Mariel, Maxine, Jordan, Daniela, Athena, Brittney, Raven, Alice, Clara & Joy: (looked happily) Meanwhile At Backbencher Flashback End Of Flashback At Hospital At Chris' House Knock knock Outside Ethan's Room End Of Chapter 39 ",Action/Adventure,Unknown
Friend's Journey,40,3,"Ethan, Brittney, Athena, Harvy, Doctor, Clarence, Macky, Lance, Marvin, Alice, Arwin, Megan, Joy, Mariel, Camille, Raven, Francis, Miggy, On Phone, Maxine","kapag may nararamdaman kang kakaiba pumunta ka lang at magpakonsulta agad samin para malaman namin kung anong nangyayari or may improvement sayo.
sure thanks doc. (Now then time to go home)
just let them celebrate mapapasatin din si harvy.
kung ano man yang naiisip mo camille sabihin mo na.
you guys remember that idiot the one ethan beat up?
oo, anong balak mo?
bakit hindi na lang natin pakiibiganin ulit kay ethan, paraan din natin to para bumagsak si ethan?
oo nga noh. Marvin call him tell him to comeback and befriend with ethan again.
sino naman yan?
kung kaya ko lang manghula kung sino to malamang sinabi ko na pangalan wait. Hello!
yo. Naka bahing ako dito muka atang pinag uusap nyo ko.
parang ganun na nga francis.
oh bakit anong meron?
comeback to the village kaibiganin mo na ulit si ethan it's payback time.
bakit hindi, sige kating kati na kong makabawi don. I'll go there.
sure make it quick (end call) pumayag na sya.
(napangiti) (you're going to lose this time ethan)
Miggy, clarence ready na kayo?
reding ready
ayan na sya.
(eto ba yung address? Muka nga pero bat walang tao? Mabuksan na nga lang)
wow ang daming handa, anong meron mom dad?
ininbita ko tito chris, tita julia at tita diana mo para iceleberate ang pagbabalik mo.
kayo naman nag abala pa kayo.
ganun talaga.
isang taon ka ba naman nawala.
at saka ganun ka kaspecial
nandyan na sila pasok
thank you po tita, tito
hi harvy
welcome back
long time no see.
nasan mga kapatid nyo?
si daniela at brian ayun mga tulog na.
yo welcome back.
balita ko ikaw ang naghatid sakin sa hospital nung naaksidente ako.
oo I'm late kaya di ko nahuli nakabangga sayo.
sorry for the trouble I caused you.
wala yun.
kilala mo pa ba sila harvy?
hmmm ikaw si Joy kapatid mo si Daniela at Bryan, at ikaw naman si Alice kapatid mo si maxine at ikaw brittney kuya mo si ethan.
mukang tumama ka dun
correct
nga pala tito kelan po papasok si harvy
i guess maybe friday.
don't worry harvy we'll introduce you to others
yes you have nothing to worry.
i hope you get along sa iba.
btw harvy this is maxine, ethan's bestfriend.
hi harvy.
hmm? Harvy?
ha......ha.......hi i'm halvy
halvy? Tito epekto po ba ng coma nya yung pagkabulol sa r?
hindi daw
ahem hi i'm harvy nice to meet you
and i'm maxine nice to meet you too
i wish he's here to join us.
you mean that idiot?
yeah.
pede mo naman titigan si ethan because he ressemble a little of that guy.
mom, dad what's wrong?
it's nothing let's eat, guys.
(hindi ko to malilimutan kahit pa bumalik ang dati kong sarili sinisiguro kong maaalala ko ang moment na to.)
ok ladies and gentlemen let's welcome the man of the hour, Harvy
i guess that completes us.
we welcome you as part ng barkada natin. Ready and...
(napangiti) thank you for the warm welcome
(it's been two years since naging part ako ng barkada and it's been two years hindi pa dun bumabalik ala-ala ko. I completely get along with them) sarap balikan yung dati ano kayang gagawin natin ngayon? Huh?
zzzzz
tulog nanaman
ok ang gagawin natin sa PE ngayon basketball, girls nood lang kayo and take some notes. Let's go to the gym."," At Hospital    At Someone's House  Guy 1: celebration? What for?  Guy 2: harvy's hospital discharge. Arwin what's the plan   ????: What's your plan for ethan ha marvin?       Ring ring           At Tambayan      Binuksan ni harvy ang pinto yun nga lang bumugad sa kanya ang paputok ng lobo na syang kinagulat at kinatuwa ni harvy.  Lance, Megan, Miggy & Clarence: welcome home harvy!        Knock   Julia, chris & diana: welcome back harvy                        Sa unang tingin pa lang ni harvy kay maxine ay nabihag agad sya nito, natulala at di alam ang sasabihin, na tila bang itinibok ng kanyang puso    Joy, Alice, Brittney: (lagot na love traingle to)            Cinelebrate nina lance ang pagka discharge ni harvy sa hospital kasama ang kanilang mga anak, ramdam ni harvy ang saya na pinapadama sa kanya nina lance at ng kanyang mga kaibigan, at unti unti nang umalis ang kanilang mga magulang para umuwi at silang magkakaibigan ang natira.      Miggy, Clarence Athena, Mariel, Clara, Raven, Ethan, Maxine, Brittney, Joy and Alice and Daniela: welcome home and welcome sa barkada!   After 2 Years  Harvy's POV      End Of Chapter 40 ",Action/Adventure,Unknown
Friend's Journey,41,3,,,,Action/Adventure,Unknown
